{"children":[{"children":[],"handlers":[{"action":{"$type":"Times","body":{"$type":"Seq","actions":[{"$type":"Beep","volume":1},{"$type":"Put","key":"seen","value":"yes"}]},"bound":3},"event":"tap"}],"id":"thrice","label":{"$type":"Const","value":"thrice"}},{"children":[],"handlers":[{"action":{"$type":"Seq","actions":[{"$type":"Put","key":"n","value":2},{"$type":"Times","body":{"$type":"Beep","volume":2},"bound":{"$type":"Parameter","count":{"$type":"Read","key":"n"},"hi":5,"lo":0}}]},"event":"tap"}],"id":"param","label":{"$type":"Const","value":"param"}},{"children":[],"handlers":[{"action":{"$type":"Seq","actions":[{"$type":"Times","body":{"$type":"Beep","volume":1},"bound":{"$type":"Parameter","count":{"$type":"Const","value":9},"hi":5,"lo":0}},{"$type":"Beep","volume":4}]},"event":"tap"}],"id":"over","label":{"$type":"Const","value":"over"}},{"children":[],"handlers":[],"id":"readout","label":{"$type":"Read","key":"seen"}}],"handlers":[],"id":"root","label":{"$type":"Const","value":"toy"}}