{"children":[{"children":[],"handlers":[],"id":"title","label":{"$type":"Const","value":"Title"}},{"children":[],"handlers":[],"id":"footer","label":{"$type":"Const","value":"Footer"}},{"children":[],"handlers":[],"id":"status","label":{"$type":"Read","key":"status"}},{"children":[],"handlers":[{"action":{"$type":"Ring","endpoint":"/handlers/off-list","targeted":false},"event":"tap"}],"id":"off-list","label":{"$type":"Const","value":"off-list"}}],"handlers":[],"id":"root","label":{"$type":"Const","value":"toy"}}