{"children":[{"children":[],"handlers":[{"action":{"$type":"Seq","actions":[{"$type":"Put","key":"msg","value":"first"},{"$type":"Put","key":"msg","value":"second"},{"$type":"Beep","volume":3}]},"event":"tap"}],"id":"set","label":{"$type":"Const","value":"set"}},{"children":[],"handlers":[],"id":"readout","label":{"$type":"Read","key":"msg"}}],"handlers":[],"id":"root","label":{"$type":"Const","value":"toy"}}