{"children":[{"children":[],"handlers":[{"action":{"$type":"Seq","actions":[{"$type":"Beep","volume":11},{"$type":"Put","key":"sys.secret","value":"no"},{"$type":"Put","key":"after","value":"ran"},{"$type":"Hush"},{"$type":"Beep","volume":3}]},"event":"tap"}],"id":"noisy","label":{"$type":"Const","value":"noisy"}},{"children":[],"handlers":[{"action":{"$type":"Put","key":"muted","value":true},"event":"tap"}],"id":"mute","label":{"$type":"Const","value":"mute"}},{"children":[],"handlers":[],"id":"after","label":{"$type":"Read","key":"after"}},{"children":[],"handlers":[],"id":"secret","label":{"$type":"Read","key":"sys.secret"}}],"handlers":[],"id":"root","label":{"$type":"Const","value":"toy"}}