{"children":[{"children":[],"handlers":[{"action":{"$type":"Pick","entry":{"$type":"Read","key":"flag"},"whenFalse":{"$type":"Put","key":"arm","value":"false-arm"},"whenTrue":{"$type":"Put","key":"arm","value":"true-arm"}},"event":"tap"}],"id":"choose","label":{"$type":"Const","value":"choose"}},{"children":[],"handlers":[{"action":{"$type":"Put","key":"flag","value":false},"event":"tap"}],"id":"lower","label":{"$type":"Const","value":"lower"}},{"children":[],"handlers":[{"action":{"$type":"Put","key":"flag","value":true},"event":"tap"}],"id":"raise","label":{"$type":"Const","value":"raise"}},{"children":[],"handlers":[],"id":"readout","label":{"$type":"Read","key":"arm"}}],"handlers":[],"id":"root","label":{"$type":"Const","value":"toy"}}