{"children":[{"children":[],"handlers":[{"action":{"$type":"Ring","endpoint":"/handlers/relabel","targeted":false},"event":"tap"}],"id":"call","label":{"$type":"Const","value":"call"}},{"children":[],"handlers":[{"action":{"$type":"Seq","actions":[{"$type":"Ring","endpoint":"/handlers/relabel","targeted":true},{"$type":"Put","key":"after","value":"ran"}]},"event":"tap"}],"id":"targeted","label":{"$type":"Const","value":"targeted"}},{"children":[],"handlers":[],"id":"title","label":{"$type":"Const","value":"Title"}},{"children":[],"handlers":[],"id":"status","label":{"$type":"Read","key":"status"}},{"children":[],"handlers":[],"id":"after","label":{"$type":"Read","key":"after"}}],"handlers":[],"id":"root","label":{"$type":"Const","value":"toy"}}