{"children":[{"children":[],"handlers":[],"id":"title","label":{"$type":"Const","value":"Title"}},{"children":[],"handlers":[],"id":"footer","label":{"$type":"Const","value":"Footer"}},{"children":[],"handlers":[],"id":"status","label":{"$type":"Read","key":"status"}},{"children":[],"handlers":[{"action":{"$type":"Ring","endpoint":"/handlers/relabel","targeted":false},"event":"tap"}],"id":"relabel","label":{"$type":"Const","value":"relabel"}}],"handlers":[],"id":"root","label":{"$type":"Const","value":"toy"}}