{"children":[{"children":[],"handlers":[{"action":{"$type":"Put","key":"msg","value":"first"},"event":"tap"}],"id":"first","label":{"$type":"Const","value":"first"}},{"children":[],"handlers":[{"action":{"$type":"Put","key":"msg","value":"second"},"event":"tap"}],"id":"second","label":{"$type":"Const","value":"second"}},{"children":[],"handlers":[],"id":"readout","label":{"$type":"Read","key":"msg"}}],"handlers":[],"id":"root","label":{"$type":"Const","value":"toy"}}